State,Candidate,Description
California,Woodrow Sanders III,"The candidate, Woodrow, presents several key proposals for improving government operations and public safety in California. Notably, he suggests:1. Allowing departmental employees to choose their department heads, ensuring that leaders have the confidence of their staff and promoting a more collaborative work environment.2. Consolidating California's 235 departments, streamlining government operations and reducing bureaucracy. Woodrow proposes creating a Chief Innovation Officer within the Office of the Governor to champion innovation across state departments.3. Limiting the amount of time department leaders can hold the same position, introducing a ""3 + 2"" system where leaders receive 360 reviews and consistently meet performance standards before being eligible for an extension.In the area of Crime & Public Safety, Woodrow's proposals focus on:1. Removing politics from California's parole and clemency process, ensuring that decisions are made based on informed, neutral assessments rather than political considerations.2. Implementing the ""Start Over Connected"" program to reduce parolee recidivism and homelessness, providing parolees with the skills and resources they need to succeed in society.3. Removing personal biases from parole decision-making, emphasizing the importance of rehabilitation and community reintegration.      Additionally, Woodrow highlights his relatable life experiences, having grown up in struggling communities and understanding the challenges faced by minority communities. He emphasizes his commitment to transforming these communities through his experiences as a student at Rio Linda High School and his participation in Army and Air Force JROTC programs.As governor, Woodrow aims to address issues such as parole reform, prisoner rehabilitation, and community reintegration, while improving government operations and reducing bureaucracy."
California,James Hanink,"**Social Issues*** Supports overturning Roe v. Wade and restricts abortion in California by limiting non-physician medical professionals from performing abortions, implementing waiting periods and counseling requirements, and strengthening health and safety codes.* Opposes increased access to abortion, including on college campuses.* Supports repealing California's End of Life Option Act and opposes assisted suicide.**Family and Marriage*** Introduces laws to protect religious institutions, small businesses, and individuals from liability for refusing to participate in activities contrary to their belief in traditional marriage.* Supports tax incentives for marriage and raising children.**Economy*** Advocates for a fair and progressive tax system that ends subsidies and exemptions for the wealthy.* Supports economic policies to expand opportunities for the poor and rebuilding the middle class.**Environment*** Calls for environmentally sustainable management practices to protect California's water supply.* Supports increasing taxes on natural resource consumption and decreasing income taxes for a net-zero tax change for the average consumer.**Civic Engagement*** Proposes replacing the state lottery with privately run prize-linked savings accounts to encourage saving.* Supports alternative voting methods, such as approval voting and ranked-choice voting.**Workplace and Education*** Protects workplace rights, including occupational safety, equal access to employment, and paid leave.* Supports subsidized preschool, tax credit programs, and public funds for private education options.**Immigration*** Advocates for a generous policy welcoming immigrants fleeing persecution and violent conflict, including equal access to driving privileges and higher education.**Crime and Justice*** Reforms the war on drugs by treating drug abuse as a medical issue instead of a criminal justice issue.* Ends the three-strikes law.Overall, the candidate prioritizes social issues, workplace and education policy, and economic and environmental reforms, while also addressing issues of civic engagement, immigration, and criminal justice."
California,Serge Fiankan,"I am personally passionate about improving Californians' cost of living, their safety, and solving the homelessness crisis."
California,Bradley Zink,"Addressing the housing crisis, the ever-increasing rise of the homeless population, and MORE funding for the public school systems."
California,Jeff Scott,Description Not Found
California,Gurinder Bhangoo,Description Not Found
Colorado,Jared Polis,"**Economy and Innovation:**The candidate is fighting for an economy that rewards hard work and provides opportunities to all American workers, and is prioritizing innovation and entrepreneurship to keep the US competitive in the 21st century.**Education:**The candidate is committed to making higher education and skill-based training more accessible and affordable, particularly through non-traditional paths, and reforming student loan programs to address unsustainable debt.**Early Childhood Education:**The candidate prioritizes expanding access to quality early childhood education, including preschool, citing experience as Chairman of the Colorado State Board of Education and founder of two charter school networks serving at-risk kids.**Campaign Finance Reform:**The candidate seeks to restore power to the people by addressing anonymous dark money and the influence of corporations in the election system, recognizing that corporations are not people and cannot vote.Overall, the candidate is focused on creating a more equitable economy, promoting innovation and entrepreneurship, and increasing access to quality education and training."
Colorado,Heidi Ganahl,"As a concerned parent, former CU Regent, and small business owner, the candidate is committed to preserving the American Dream for Colorado's children. They propose funding families rather than the education system to address learning gaps and promote transparency in curriculum and a focus on fundamentals like reading, writing, and math. The candidate also prioritizes school safety, encouraging school districts to utilize School Resource Officers and enhanced security measures. In family courts and welfare systems, they aim to provide critical reforms to help children thrive. Additionally, the candidate wants to reduce government regulations to encourage job creation, drawing from their own experience as a small business owner. They also intend to combat the fentanyl crisis in Colorado by re-criminalizing fentanyl possession and ending the state's status as a sanctuary state."
Connecticut,Ned Lamont,Description Not Found
Connecticut,Bob Stefanowski,Description Not Found
Delaware,Matt Meyer,"Education, Housing, Economic Development, Healthcare, Environment, Criminal Justice Reform."
Delaware,Michael Ramone,"**Education and Qualifications**: Mike Ramone is a small business owner who has employed over 200 people throughout Delaware and has served on the Delaware House of Representatives Veterans Affairs Committee for over a decade. He is a parent of three and a grandfather of four.**Key Issues and Positions**:1. **Education**: Ramone wants to empower Delaware students by providing teachers with the necessary tools, resources, and classrooms to provide a quality education, despite having the fourth-highest per capita spending per student.2. **Supporting Main Street**: As a small business owner, Ramone aims to reduce burdensome regulations, consolidate the state income tax, and provide relief to hardworking Delawareans to turn around the state's poor environment for new and existing businesses.3. **Good Governance**: Ramone promotes responsible spending by holding lawmakers and government agencies accountable, after 32 years of self-interest by Dover.4. **Keeping Communities Safe**: Ramone vows to ensure state police and local law enforcement have the necessary tools and resources to keep communities safe, citing concerns over rising crime rates and rampant drug use.5. **Expanding Veterans Benefits**: As Governor, Ramone would eliminate the state income tax on veterans benefits, expand access to mental health resources, and ensure Delaware's veteran community is no longer forgotten.6. **Protecting the Environment**: Ramone would make Delaware a leader in expanding research into alternative energy sources, conserving the environment, and promoting free market investment and environmental research.7. **Improving Healthcare**: Ramone aims to remove regulatory burdens, promote healthcare competition, and give Delawareans access to effective and efficient healthcare.8. **Investing in Infrastructure**: Ramone believes infrastructure is crucial for successful economies and would make necessary investments in roads, ports, and rural broadband access to give Delaware a competitive advantage in economic growth and investment."